headline,published_at
"Dividend, stock-split: IDFC, ARC Finance, Vedanta, 3 others in focus today",2024-10-09T03:21:13Z
"Hyundai Motor India's Rs 27,856 crore IPO opens on 15th Oct; price band fixed at Rs 1,865-1,960",2024-10-09T03:21:07Z
Tiger Brokers' Yang Xu Shares Insights on Bitcoin ETFs Bridging the Gap Between Traditional Finance and Digital Assets,2024-10-09T03:12:04Z
Top German Dividend Stocks To Watch In October 2024,2024-10-09T03:07:48Z
Oil prices steady after sliding on potential Israel-Hezbollah ceasefire,2024-10-09T03:06:35Z
China stocks lose steam as stimulus skepticism emerges,2024-10-09T03:04:28Z
Mixed Asian cues may limit Nifty's opening gains,2024-10-09T03:04:00Z
Three Undiscovered German Gems With Promising Potential,2024-10-09T03:03:53Z
German Growth Stocks With High Insider Ownership,2024-10-09T03:03:32Z
Oil prices steady after sliding on potential Israel-Hezbollah ceasefire,2024-10-09T03:00:37Z
"Chinese Shares Drop On Stimulus Upset, Asia Tracks Wall St Higher",2024-10-09T03:00:20Z
Buy power utilities but stay away from power financiers: Chakri Lokapriya,2024-10-09T03:00:00Z
Why ASX 200 bank shares like CBA are surging on disappointing China stimulus,2024-10-09T02:58:34Z
"Chinese shares drop on stimulus upset, Asia tracks Wall St higher",2024-10-09T02:58:33Z
"While individual investors own 30% of Wing Tai Holdings Limited (SGX:W05), private companies are its largest shareholders with 51% ownership",2024-10-09T02:54:57Z
"Stock Alert: Phoenix Mills, Signature Global, Infosys, Dr reddys Lab, IRFC",2024-10-09T02:54:00Z
Golden Crossovers: These 5 stocks signal further bullishness on Oct 9,2024-10-09T02:51:06Z
The iShares S&P 500 ETF (IVV) just hit a new all-time high,2024-10-09T02:50:07Z
Watch These Palantir Price Levels as Stock Surges More Than 6% to Record High,2024-10-09T02:39:53Z
"Stocks that will see action today: October 9, 2024",2024-10-09T02:38:03Z
"Stocks that will see action today: October 9, 2024",2024-10-09T02:38:03Z
Markets expected to open steady ahead of RBI policy outcome,2024-10-09T02:35:08Z
"NZ stocks rally, kiwi dollar, interest rates fall on OCR cut",2024-10-09T02:33:41Z
Positive Breakout: These 3 Nifty stocks close cross above their 200 DMAs,2024-10-09T02:33:25Z
5 FMCG stocks Rajat Sharma is bullish on for near term,2024-10-09T02:31:00Z
Asia stocks rise on tech gains; China slides as stimulus cheer wanes,2024-10-09T02:29:11Z
Stock to watch: Edelweiss Financial in focus as co announces Rs 200 crore NCDs,2024-10-09T02:22:33Z
NeoPolitan Pizza shares to debut today. GMP hints at flat listing,2024-10-09T02:22:06Z
Vinay Rajani of HDFC Securities suggests buying these stocks on October 09,2024-10-09T02:17:32Z
Stock to watch: JSW Infrastructure shares in focus after MD & CEO steps down,2024-10-09T02:16:23Z
Economic Digest: Nepal’s Weekly Business News in a Snap,2024-10-09T02:15:17Z
China’s stocks head for topsy-turvy day: Hang Seng gains while mainland markets plunge,2024-10-09T02:08:47Z
"China stocks fall sharply, set to snap winning streak",2024-10-09T02:05:42Z
Stock to watch: Infosys shares in focus on expansion of partnership with Old National Bank,2024-10-09T01:59:59Z
"China stocks fall sharply, set to snap winning streak",2024-10-09T01:57:51Z
Sensex Today | Stock Market LIVE Updates: GIFT Nifty signals a positive start; Asian shares trade higher,2024-10-09T01:56:15Z
"F&O Ban List: SAIL, GNFC among 10 stocks under trade ban on Wednesday",2024-10-09T01:55:51Z
"China stocks fall sharply, set to snap winning streak",2024-10-09T01:55:36Z
"China stocks fall sharply, set to snap winning streak",2024-10-09T01:53:16Z
"Market Today: RBI MPC outcome, global market recovery, Israel war, Oil down",2024-10-09T01:52:55Z
"Big movers on D-Street: What should investors do with Trent, Sobha and SpiceJet?",2024-10-09T01:50:15Z
"Stocks to Watch: RIL, TaMo, Torrent Power, Tata Tech, Patanjali Foods",2024-10-09T01:49:03Z
Gold prices steady with Fed minutes on tap,2024-10-09T01:44:36Z
"Why Karoon Energy, Mesoblast, Mineral Resources, and Sigma shares are falling today",2024-10-09T01:44:25Z
Wall Street ends higher on tech buying as investors wait on inflation data,2024-10-09T01:42:26Z
Catastrophe Bond Investors Brace for Major Losses as Milton Rages - Yahoo Finance,2024-10-09T01:32:52Z
Trade desk CEO Jeffrey Green sells over $45 million in stock,2024-10-09T01:23:52Z
Pre-market action: Here's the trade setup for today's session,2024-10-09T01:15:39Z
"Closing Bell: Sensex falls by 0.21%, Nifty closes at 24,981.95",2024-10-09T01:14:46Z
"Share Market Highlights 9th October 2024: Sensex closes at 81,634.81, Nifty closes at 25,013. Top gainers Tata Motors, Tech Mahindra",2024-10-09T01:14:46Z
Asian stocks advance after tech lifts Wall Street,2024-10-09T01:10:29Z
"Stocks in news: Adani Green, Infosys, Torrent Power, Dr Reddy's, JSW Infra",2024-10-09T01:05:10Z
SpaceX Activates Starlink T Mobile Text SMS Messaging In Florida Ahead Of Hurricane Milton’s Arrival,2024-10-09T01:05:00Z
CNBC Daily Open: Stocks’ choppiness in October can be an opportunity,2024-10-09T01:01:53Z
CNBC Daily Open: Stocks’ choppiness in October can be an opportunity,2024-10-09T00:50:04Z
Is GE-Shen Corporation Berhad's (KLSE:GESHEN) Stock's Recent Performance A Reflection Of Its Financial Health?,2024-10-09T00:35:22Z
"These are the insurance stocks with the most at risk from Hurricane Milton, according to Piper Sandler - CNBC",2024-10-09T00:33:43Z
"Parliamentary Finance Panel calls Sebi, other regulators",2024-10-09T00:32:10Z
"Nine Entertainment Holdings (ASX:NEC) sheds AU$87m, company earnings and investor returns have been trending downwards for past three years",2024-10-09T00:28:02Z
Biocon Biologics raises $300 million for debt refinancing,2024-10-09T00:10:54Z
Asian Stocks Advance After Tech Lifts Wall Street: Markets Wrap,2024-10-09T00:08:24Z
Nifty's over 4% falls in a week mostly recovered within 3 months: Study,2024-10-09T00:05:58Z
FDI crashes to record low of $29.8m,2024-10-09T00:04:57Z
D-Street ends 6-Day losing streak as China stocks retreat from highs,2024-10-09T00:02:11Z
Sebi calls for stricter review of AIF investors,2024-10-08T23:57:56Z
"These are the insurance stocks with the most at risk from Hurricane Milton, according to Piper Sandler",2024-10-08T23:55:05Z
Florida's Insurance Market Lashed as Residents Face Hurricane Milton - Newsweek,2024-10-08T23:52:51Z
We're Not Very Worried About Brazilian Rare Earths' (ASX:BRE) Cash Burn Rate,2024-10-08T23:51:24Z
Wednesday's big stock stories: What’s likely to move the market in the next trading session,2024-10-08T23:49:57Z
Sprouts farmers market CEO sells over $1.29 million in stock,2024-10-08T23:49:07Z
Is Kretam Holdings Berhad's (KLSE:KRETAM) Stock's Recent Performance A Reflection Of Its Financial Health?,2024-10-08T23:36:47Z
"Stock market volatility; Premier Li meetings on the economy; PRC goes after EU brandy; Wu Bangguo; Wang-Raimondo call; MSS on the ""China Initiative""",2024-10-08T23:31:29Z
Full House Resorts CEO sells over $125k in company stock,2024-10-08T23:27:02Z
"Midday stock movers: Nvidia, PepsiCo, Qualcomm",2024-10-08T23:21:24Z
A closer look at the USMNT striker picture for October window,2024-10-08T23:15:58Z
Most Justices Seem Inclined To Uphold the ATF's New Restrictions on Homemade Firearms,2024-10-08T23:15:46Z
How to generate passive income from ASX ETFs,2024-10-08T23:13:05Z
Most Justices Seem Inclined To Uphold the ATF's New Restrictions on Homemade Firearms,2024-10-08T23:10:26Z
2 ASX growth shares this fund manager loves right now (one with AI exposure!),2024-10-08T23:03:19Z
Loop-the-loop - the people who run around in circles for 24 hours,2024-10-08T23:01:19Z
Enliven Therapeutics exec sells over $280k in company stock,2024-10-08T23:01:00Z
Beijing Announces Tariffs on European Brandy,2024-10-08T23:00:30Z
Hong Kong Stocks Plunge on Profit-Taking Amid China Market Rebound,2024-10-08T22:59:27Z
Wall Street soars as Hong Kong sees biggest single-day drop since 2008,2024-10-08T22:59:26Z
Jim Cramer looks at Amazon and Apple and why it can be tough to sit on good stocks,2024-10-08T22:59:18Z
"Future Holds Oligopoly of 4 Streaming Giants, ‘Great Profitability’ and Price Increases, Says Jeff Sagansky",2024-10-08T22:55:00Z
Catastrophe Bond Investors Brace for Huge Losses as Milton Rages - Bloomberg,2024-10-08T22:53:29Z
Jim Cramer looks at Amazon and Apple and why it can be tough to sit on good stocks,2024-10-08T22:52:11Z
China slump hits European luxury,2024-10-08T22:48:27Z
Chinese Hackers Target U.S. Telecoms,2024-10-08T22:45:11Z
Ares management executive sells $3.2 million in company stock,2024-10-08T22:32:28Z
What's Next For Chinese Stocks After Stimulus Rally Stumbles?,2024-10-08T22:31:43Z
"Bitcoin Wavers at $62K Amid Major Swings in Stocks, Gold; Memecoins Falter as Profit-Taking Sets In",2024-10-08T22:15:03Z
Short sellers accuse Roblox of inflating user stats and enabling child exploitation,2024-10-08T22:12:56Z
These 2 simple ASX index funds could turn $100 a month into $1 million,2024-10-08T22:12:10Z
Investors Could Be Concerned With Betamek Berhad's (KLSE:BETA) Returns On Capital,2024-10-08T22:08:48Z
U.S. stocks ended higher as investors await inflation data,2024-10-08T22:07:00Z
[Removed],2024-10-08T22:05:49Z
3 Overlooked Dividend Stocks That Analysts Love,2024-10-08T22:04:19Z
Catastrophe Bond Investors Brace for Huge Losses as Milton Rages,2024-10-08T21:53:47Z
